nexus_label	catalog_series	catalog_number	field_series	field_number	genus	epithet	country	island	locality	Latitude	Longitude	date	extraction.msg_barcode	Geo_referenced	figure_label
redimiculusPalawan	KU	309330	RMB	7859	Cyrtodactylus	redimiculus	Philippines	Palawan	Palawan Province; Municipality of Brooke's Point; Barangay Samarinana (Border with Barangay Saulog), Mt. Mantalingahan Range, Area Pitang	8.7503	117.6896	3/31/07	CTCTGG	FALSE	1
tautbatorumPalawan	KU	309320	RMB	7647	Cyrtodactylus	tautbatorum	Philippines	Palawan	Palawan Province; Municipality of Brooke's Point; Barangay Mainit, Mainit Falls	9.8367333	118.6416167	3/23/07	ATCCAG	FALSE	2
jambanganMindanao	KU	319844	RMB	11670	Cyrtodactylus	jambangan	Philippines	Mindanao	Zamboanga City Province; Municipality of Pasonanca; Pasonanca Natural Park, Barangay Tulosa, Sitio Santa Clara, Cabo Negro Outpost	7.108	122.119	4/9/09	AACAGG	FALSE	3
annulatusCamiguinSur	KU	309365	RMB	8043	Cyrtodactylus	annulatus	Philippines	Camiguin Sur	Camiguin Province; Municipality of Mambajao; Barangay Pandan, Sito Pamahawan	9.212117	124.740601	6/3/07	TAGCTG	TRUE	4
annulatusCebu	KU	305569	CWL	89	Cyrtodactylus	annulatus	Philippines	Cebu	Cebu Province; Municipality of Alcoy; Barangay Nug-as, CBCF field station	9.71368	123.44672	6/11/06	TACAAG	FALSE	5
annulatusBohol	KU	324366	CDS	4485	Cyrtodactylus	annulatus	Philippines	Bohol	Bohol Province; Municipality of Bilar; Barangay Riverside; Magsaysay Park; Raja Sikatuna Natural Park	9.70551	124.12344	8/1/09	AAATAG	FALSE	6
mamanwaDinagat	KU	310102	RMB	8444	Cyrtodactylus	mamanwa	Philippines	Dinagat	Dinagat Islands Province; Municipality of Loreto; Barangay Santiago, sitio Cambinlia (Sudlon)	10.3436833	125.6181167	8/4/07	AATTGG	FALSE	7
sumuroiSamar	KU	310798	CDS	2844	Cyrtodactylus	sumuroi	Philippines	Samar	Eastern Samar Province; Municipality of Taft; Barangay San Rafael	11.80255	125.29276	10/17/07	TATTAG	FALSE	8
gubaotLeyte	KU	326522	RMB	8933	Cyrtodactylus	gubaot	Philippines	Leyte	Leyte Province; Municipality of Baybay; Visayas State University Campus	10.7451667	124.8042833	4/16/08	CTTCGG	FALSE	9
philippinicusLubang	KU	320351	CDS	3932	Cyrtodactylus	philippinicus	Philippines	Lubang	Occidental Mindoro Province; Municipality of Lubang; Barangay Vigo, Sitio Dangay	13.79995	120.16393		CTTGCG	FALSE	10
philippinicusTablas	KU	315340	RMB	8761	Cyrtodactylus	philippinicus	Philippines	Tablas	Romblon Province; Municipality of Calatrava; Barangay Balogo: Sitio Piqueno	12.60523	122.04552	1/7/08	CACATG	FALSE	11
philippinicusSibuyan	KU	302635	CDS	1442	Cyrtodactylus	philippinicus	Philippines	Sibuyan	Romblon Province; Municipaity of Magdiwang; Barangay Talaba, Mount Guiting-Guiting Natural Park	12.4612167	122.66435	3/24/01	TTCTCG	FALSE	12
philippinicusMindoroELR	KU	305431	ELR	682	Cyrtodactylus	philippinicus	Philippines	Mindoro	Occidental Mindoro Province; Municipality of Sablayan; Barangay Batong Buhay	13.7955	120.15965	9/18/06	AAATAG	TRUE	13
philippinicusLuzonCamarinesNorte	KU	313820	RMB	9748	Cyrtodactylus	philippinicus	Philippines	Luzon	Camarines Norte Province; Municipality of Labo; Barangay Tulay Na Lupa, Mt. Labo camp 1	14.02381	122.47294	6/24/08	TTATAG	FALSE	14
philippinicusNegros	KU	324376	CDS	4341	Cyrtodactylus	philippinicus	Philippines	Negros	Negros Occidental Province; ; Barangay Patag; city of Silay; Mt. Bungol	10.67599	123.18777	7/21/09	TAGCTG	FALSE	15
philippinicusPanay	KU	302639	CDS	173	Cyrtodactylus	philippinicus	Philippines	Panay	Antique Province; Municipality of Pandan; Barangay Duyong	11.7609167	122.0411833	10/16/00	ATCTTG	FALSE	16
philippinicusMindoroRMB	KU	306612	RMB	6455	Cyrtodactylus	philippinicus	Philippines	Mindoro	Occidental Mindoro Province; Municipality of Sablayan; Barangay Batong Buhay	13.7955	120.15965	10/3/06	TATGCG	TRUE	17
philippinicusLuzonAlbay	KU	328804	RMB	13669	Cyrtodactylus	philippinicus	Philippines	Luzon	Albay Province; Municipality of Malinao; Barangay Sugcad, Sitio Kumagingking, Sugcad Plaza	13.40508	123.63882	1/5/11	TTCGAG	FALSE	18
philippinicusLuzonAurora	KU	323191	RMB	12836	Cyrtodactylus	philippinicus	Philippines	Luzon	Aurora Province; Municipality of San Luis; Barangay Real, Sitio Minoli, limestone forest	15.68	121.529	6/13/09	TTAGCG	FALSE	19
philippinicusPolillo	KU	307451	RMB	6259	Cyrtodactylus	philippinicus	Philippines	Polillo	Quezon Province; Municipality of Polillo; Barangay Pinaglubayan	14.75255	121.9683167	7/22/06	TACGTG	FALSE	20
philippinicusLuzonLaguna	KU	330798	CDS	5823	Cyrtodactylus	philippinicus	Philippines	Luzon	Laguna Province; Municipality of Los Banos; Barangay Bagong Silang, Mt. Makiling Forest Reserve, Camp Malaboo	14.13356	121.20447	5/11/11	TTCAGG	FALSE	21
philippinicusLuzonBulacan	KU	329351	RMB	13964	Cyrtodactylus	philippinicus	Philippines	Luzon	Bulacan Province; Municipality of Dona Remedios Trinidad; Barangay Kabayunan, Sitio Langud, Langud River, Angat Watershed	15.0333	121.2032	6/10/11	TACTGG	FALSE	22
philippinicusLuzonCagayan	KU	330195	RMB	15119	Cyrtodactylus	philippinicus	Philippines	Luzon	Cagayan Province; Municipality of Gonzaga; Barangay Magrafil, Site 2, Mt. Cagua	18.236	122.104	7/26/11	GTCATG	FALSE	23
philippinicusBabuyanClaro	KU	304784	RMB	5905	Cyrtodactylus	philippinicus	Philippines	Babuyan Claro	Cagayan Province; Municipality of Calayan; Barangay Babuyan Claro, Local Name Asked	19.510602	121.947027	3/12/06	AAGACG	TRUE	24
philippinicusLuzonNuevaVizcaya	KU	325814	RMB	13366	Cyrtodactylus	philippinicus	Philippines	Luzon	Nueva Vizcaya Province; Municipality of Quezon; Barangay Maddiangat, Sitio Upper Dayog	16.462	121.22	1/10/10	ATGATG	FALSE	25
philippinicusLuzonIlocosNorte	KU	329534	RMB	14453	Cyrtodactylus	philippinicus	Philippines	Luzon	Ilocos Norte Province; Municipality of Adams; Barangay Adams, Site 3, Mt. Pao	18.449	120.894	6/27/11	GATGAG	FALSE	26
philippinicusCamiguinNorte	KU	304634	RMB	5754	Cyrtodactylus	philippinicus	Philippines	Camiguin Norte	Cagayan Province; Municipality of Calayan; Barangay Balatabat, Local Name Limandok	18.92927	121.89881	3/7/06	TTTGTG	FALSE	27
